{
    "$schema": "http://json-schema.org/schema#",
    "type": "object",
    "properties": {
        "biomarker_id": {
            "type": "string"
        },
        "biomarker_canonical_id": {
            "type": "string"
        },
        "biomarker_id_md5": {
            "type": "string"
        },
        "canon_id_md5": {
            "type": "string"
        },
        "biomarker_id_new": {
            "type": "string"
        },
        "condition": {
            "type": "object",
            "properties": {
                "id": {
                    "type": "string"
                },
                "recommended_name": {
                    "type": "object",
                    "properties": {
                        "id": {
                            "type": "string"
                        },
                        "name": {
                            "type": "string"
                        },
                        "description": {
                            "type": "string"
                        },
                        "resource": {
                            "type": "string"
                        },
                        "url": {
                            "type": "string"
                        }
                    },
                    "required": [
                        "description",
                        "id",
                        "name",
                        "resource",
                        "url"
                    ]
                }
            },
            "required": [
                "id",
                "recommended_name"
            ]
        },
        "best_biomarker_role": {
            "type": "array",
            "items": {
                "type": "object",
                "properties": {
                    "role": {
                        "type": "string"
                    }
                },
                "required": [
                    "role"
                ]
            }
        },
        "biomarker_component": {
            "type": "array",
            "items": {
                "type": "object",
                "properties": {
                    "assessed_biomarker_entity_id": {
                        "type": "string"
                    },
                    "assessed_biomarker_entity_url": {
                        "type": "string"
                    },
                    "assessed_biomarker_entity": {
                        "type": "object",
                        "properties": {
                            "recommended_name": {
                                "type": "string"
                            },
                            "synonyms": {
                                "type": "array",
                                "items": {
                                    "type": "object",
                                    "properties": {
                                        "synonym": {
                                            "type": "string"
                                        }
                                    },
                                    "required": [
                                        "synonym"
                                    ]
                                }
                            }
                        },
                        "required": [
                            "recommended_name",
                            "synonyms"
                        ]
                    },
                    "assessed_entity_type": {
                        "type": "string"
                    },
                    "biomarker_orig": {
                        "type": "string"
                    },
                    "biomarker": {
                        "type": "string"
                    },
                    "evidence_source": {
                        "type": "array",
                        "items": {
                            "type": "object",
                            "properties": {
                                "id": {
                                    "type": "string"
                                },
                                "database": {
                                    "type": "string"
                                },
                                "url": {
                                    "type": "string"
                                },
                                "evidence_list": {
                                    "type": "array",
                                    "items": {
                                        "type": "object",
                                        "properties": {
                                            "evidence": {
                                                "type": "string"
                                            }
                                        },
                                        "required": [
                                            "evidence"
                                        ]
                                    }
                                },
                                "tags": {
                                    "type": "array",
                                    "items": {
                                        "type": "object",
                                        "properties": {
                                            "tag": {
                                                "type": "string"
                                            }
                                        },
                                        "required": [
                                            "tag"
                                        ]
                                    }
                                }
                            },
                            "required": [
                                "database",
                                "id",
                                "url"
                            ]
                        }
                    },
                    "specimen": {
                        "type": "array",
                        "items": {
                            "type": "object",
                            "properties": {
                                "id": {
                                    "type": "string"
                                },
                                "name": {
                                    "type": "string"
                                },
                                "loinc_code": {
                                    "type": "string"
                                },
                                "name_space": {
                                    "type": "string"
                                },
                                "url": {
                                    "type": "string"
                                },
                                "loince_code_url": {
                                    "type": "string"
                                }
                            },
                            "required": [
                                "id",
                                "loinc_code",
                                "loince_code_url",
                                "name",
                                "name_space",
                                "url"
                            ]
                        }
                    }
                },
                "required": [
                    "assessed_biomarker_entity",
                    "assessed_biomarker_entity_id",
                    "assessed_biomarker_entity_url",
                    "assessed_entity_type",
                    "biomarker",
                    "biomarker_orig",
                    "evidence_source",
                    "specimen"
                ]
            }
        },
        "evidence_source": {
            "type": "array",
            "items": {
                "type": "object",
                "properties": {
                    "id": {
                        "type": "string"
                    },
                    "database": {
                        "type": "string"
                    },
                    "url": {
                        "type": "string"
                    },
                    "evidence_list": {
                        "type": "array",
                        "items": {
                            "type": "object",
                            "properties": {
                                "evidence": {
                                    "type": "string"
                                }
                            },
                            "required": [
                                "evidence"
                            ]
                        }
                    },
                    "tags": {
                        "type": "array",
                        "items": {
                            "type": "object",
                            "properties": {
                                "tag": {
                                    "type": "string"
                                }
                            },
                            "required": [
                                "tag"
                            ]
                        }
                    }
                },
                "required": [
                    "database",
                    "evidence_list",
                    "id",
                    "tags",
                    "url"
                ]
            }
        },
        "crossref": {
            "type": "array",
            "items": {
                "type": "object",
                "properties": {
                    "id": {
                        "type": "string"
                    },
                    "url": {
                        "type": "string"
                    },
                    "database": {
                        "type": "string"
                    }
                },
                "required": [
                    "database",
                    "id",
                    "url"
                ]
            }
        },
        "entity_normal_ranges": {
            "type": "array",
            "items": {
                "type": "object",
                "properties": {
                    "entity_name": {
                        "type": "string"
                    },
                    "entity_id": {
                        "type": "string"
                    },
                    "source": {
                        "type": "array",
                        "items": {
                            "type": "object",
                            "properties": {
                                "source_name": {
                                    "type": "string"
                                },
                                "lab_term": {
                                    "type": "string"
                                },
                                "ranges": {
                                    "type": "array",
                                    "items": {
                                        "type": "object",
                                        "properties": {
                                            "age_grp": {
                                                "type": "string"
                                            },
                                            "sex": {
                                                "type": "string"
                                            },
                                            "mean_val": {
                                                "type": "number"
                                            },
                                            "median_val": {
                                                "type": "number"
                                            },
                                            "sd_val": {
                                                "type": "number"
                                            },
                                            "min": {
                                                "type": "number"
                                            },
                                            "max": {
                                                "type": "number"
                                            },
                                            "q1": {
                                                "type": "number"
                                            },
                                            "q3": {
                                                "type": "number"
                                            },
                                            "iqr": {
                                                "type": "number"
                                            },
                                            "lower_whisker": {
                                                "type": "number"
                                            },
                                            "upper_whisker": {
                                                "type": "number"
                                            },
                                            "n_val": {
                                                "type": "integer"
                                            },
                                            "units": {
                                                "type": "string"
                                            }
                                        },
                                        "required": [
                                            "age_grp",
                                            "iqr",
                                            "lower_whisker",
                                            "max",
                                            "mean_val",
                                            "median_val",
                                            "min",
                                            "n_val",
                                            "q1",
                                            "q3",
                                            "sd_val",
                                            "sex",
                                            "units",
                                            "upper_whisker"
                                        ]
                                    }
                                }
                            },
                            "required": [
                                "lab_term",
                                "ranges",
                                "source_name"
                            ]
                        }
                    }
                },
                "required": [
                    "entity_id",
                    "entity_name",
                    "source"
                ]
            }
        },
        "source_list": {
            "type": "array",
            "items": {
                "type": "string"
            }
        },
        "citation": {
            "type": "array",
            "items": {
                "type": "object",
                "properties": {
                    "title": {
                        "type": "string"
                    },
                    "journal": {
                        "type": "string"
                    },
                    "date": {
                        "type": "string"
                    },
                    "authors": {
                        "type": "string"
                    },
                    "reference": {
                        "type": "array",
                        "items": {
                            "type": "object",
                            "properties": {
                                "id": {
                                    "type": "string"
                                },
                                "type": {
                                    "type": "string"
                                },
                                "url": {
                                    "type": "string"
                                }
                            },
                            "required": [
                                "id",
                                "type",
                                "url"
                            ]
                        }
                    }
                },
                "required": [
                    "authors",
                    "date",
                    "journal",
                    "reference",
                    "title"
                ]
            }
        }
    },
    "required": [
        "best_biomarker_role",
        "biomarker_canonical_id",
        "biomarker_component",
        "biomarker_id",
        "biomarker_id_md5",
        "biomarker_id_new",
        "canon_id_md5",
        "citation",
        "condition",
        "crossref",
        "entity_normal_ranges",
        "evidence_source",
        "source_list"
    ]
}
